{
  "schemaVersion": "2.0.0",
  "id": "topic:clinical-mnemonics:anatomy-musculoskeletal:point-and-shoot",
  "slug": "point-and-shoot",
  "title": "Point and Shoot",
  "subject": {
    "id": "subject:clinical-mnemonics",
    "slug": "clinical-mnemonics",
    "title": "Clinical Mnemonics"
  },
  "unit": {
    "id": "unit:clinical-mnemonics:anatomy-musculoskeletal",
    "slug": "anatomy-musculoskeletal",
    "title": "Anatomy & Musculoskeletal",
    "order": 5
  },
  "order": 3,
  "status": "final",
  "sections": {
    "overview": "Links the autonomic divisions to male sexual response - Parasympathetic 'Points' (erection) and Sympathetic 'Shoots' (ejaculation).",
    "whyItMatters": "",
    "learningObjectives": "",
    "keyTerms": "- **Point** — Point = Parasympathetic = Erection\n- **Shoot** — Shoot = Sympathetic = Ejaculation",
    "collegeNotes": "**Status: current, with caveats.** The source library flags this one as still taught but qualified — read the safety notes on each component before relying on it.\n\nLinks the autonomic divisions to male sexual response - Parasympathetic 'Points' (erection) and Sympathetic 'Shoots' (ejaculation).\n\n### Point — Point = Parasympathetic = Erection\n\nParasympathetic nervous system (pelvic splanchnic nerves, S2-S4) mediates erection and female engorgement/lubrication\n\nParasympathetic nerves release nitric oxide (NO), activating guanylate cyclase to raise cGMP and relax corpus cavernosum smooth muscle, dilating helicine arteries and producing erection. In females, parasympathetic activity mediates clitoral engorgement and vaginal lubrication.\n\n**Physiology.** Flaccidity is maintained by tonic sympathetic tone; erection requires parasympathetic NO release to override that tone. Both psychogenic and reflexogenic pathways can trigger erection.\n\n**Safety.** Erectile dysfunction can be an early marker of cardiovascular disease or diabetes; assess risk factors and refer appropriately.\n\n### Shoot — Shoot = Sympathetic = Ejaculation\n\nSympathetic nervous system (hypogastric nerves, T10-L2) mediates emission; somatic pudendal nerve (S2-S4) performs expulsion\n\nEjaculation occurs in two phases: (1) emission - sympathetic contraction of the vas deferens, seminal vesicles, and prostate plus internal urethral sphincter (bladder neck) closure; and (2) expulsion - somatic (pudendal nerve, S2-S4) rhythmic contraction of the bulbospongiosus and ischiocavernosus muscles.\n\n**Physiology.** If the sympathetic bladder-neck 'lock' fails, semen flows backward into the bladder - retrograde ejaculation ('dry orgasm').\n\n**Safety.** Retrograde ejaculation is usually benign but affects fertility; document and discuss causes (TURP, alpha-blockers, diabetes).",
    "howItWorks": "",
    "comparisons": "",
    "highYield": "",
    "commonConfusions": "",
    "memoryAids": "- Point = Point = Parasympathetic = Erection\n- Shoot = Shoot = Sympathetic = Ejaculation",
    "eli10": "A two-word reminder that the 'rest and relax' nervous system makes the penis point (get erect) and the 'action' nervous system makes it shoot (ejaculate) - with a big warning that real sexual function is more complicated.\n\n**Point — Point = Parasympathetic = Erection.** When the 'rest and relax' system turns on, it releases a gas-like chemical (nitric oxide) that tells the spongy tubes in the penis to relax and open, letting blood rush in and fill them - that's what makes it stand up ('point').\n\n**Shoot — Shoot = Sympathetic = Ejaculation.** When the 'action' system turns on, it squeezes the sperm and fluids along their tubes and out the end ('shoot'), while a back door (the bladder neck) locks shut so the fluid only goes forward.",
    "quickReview": "- Point = Point = Parasympathetic = Erection — Parasympathetic nervous system (pelvic splanchnic nerves, S2-S4) mediates erection and female engorgement/lubrication\n- Shoot = Shoot = Sympathetic = Ejaculation — Sympathetic nervous system (hypogastric nerves, T10-L2) mediates emission; somatic pudendal nerve (S2-S4) performs expulsion",
    "workedExamples": "",
    "references": []
  },
  "availability": {
    "collegeNotes": true,
    "eli10": true,
    "highYield": false,
    "quickReview": true,
    "workedExamples": false,
    "references": false,
    "exactQuestions": 0
  },
  "aliases": [
    {
      "value": "point-and-shoot",
      "kind": "canonical_slug"
    }
  ],
  "authority": {
    "college_notes": [
      {
        "source_file": "generated-subjects/medical-nursing-mnemonics/data/mnemonics.json"
      }
    ],
    "eli10": [
      {
        "source_file": "generated-subjects/medical-nursing-mnemonics/data/mnemonics.json"
      }
    ]
  },
  "provenance": {
    "sourceCollection": "medical-nursing-mnemonics",
    "sourceFile": "generated-subjects/medical-nursing-mnemonics/data/mnemonics.json",
    "sourceStatus": "CURRENT_WITH_CAVEATS",
    "importedWithoutRewriting": true,
    "importBatch": "2026-08-14-clinical-mnemonics"
  },
  "sourceSnapshotMarkdown": "{\n  \"mnemonic\": \"Point and Shoot\",\n  \"category\": \"Anatomy & Musculoskeletal\",\n  \"purpose\": \"Links the autonomic divisions to male sexual response - Parasympathetic 'Points' (erection) and Sympathetic 'Shoots' (ejaculation).\",\n  \"eli10_purpose\": \"A two-word reminder that the 'rest and relax' nervous system makes the penis point (get erect) and the 'action' nervous system makes it shoot (ejaculate) - with a big warning that real sexual function is more complicated.\",\n  \"status\": \"CURRENT_WITH_CAVEATS\",\n  \"components\": [\n    {\n      \"symbol\": \"Point\",\n      \"term\": \"Point = Parasympathetic = Erection\",\n      \"association\": \"Parasympathetic nervous system (pelvic splanchnic nerves, S2-S4) mediates erection and female engorgement/lubrication\",\n      \"eli10\": \"When the 'rest and relax' system turns on, it releases a gas-like chemical (nitric oxide) that tells the spongy tubes in the penis to relax and open, letting blood rush in and fill them - that's what makes it stand up ('point').\",\n      \"clinical_explanation\": \"Parasympathetic nerves release nitric oxide (NO), activating guanylate cyclase to raise cGMP and relax corpus cavernosum smooth muscle, dilating helicine arteries and producing erection. In females, parasympathetic activity mediates clitoral engorgement and vaginal lubrication.\",\n      \"physiology\": \"Flaccidity is maintained by tonic sympathetic tone; erection requires parasympathetic NO release to override that tone. Both psychogenic and reflexogenic pathways can trigger erection.\",\n      \"safety_note\": \"Erectile dysfunction can be an early marker of cardiovascular disease or diabetes; assess risk factors and refer appropriately.\"\n    },\n    {\n      \"symbol\": \"Shoot\",\n      \"term\": \"Shoot = Sympathetic = Ejaculation\",\n      \"association\": \"Sympathetic nervous system (hypogastric nerves, T10-L2) mediates emission; somatic pudendal nerve (S2-S4) performs expulsion\",\n      \"eli10\": \"When the 'action' system turns on, it squeezes the sperm and fluids along their tubes and out the end ('shoot'), while a back door (the bladder neck) locks shut so the fluid only goes forward.\",\n      \"clinical_explanation\": \"Ejaculation occurs in two phases: (1) emission - sympathetic contraction of the vas deferens, seminal vesicles, and prostate plus internal urethral sphincter (bladder neck) closure; and (2) expulsion - somatic (pudendal nerve, S2-S4) rhythmic contraction of the bulbospongiosus and ischiocavernosus muscles.\",\n      \"physiology\": \"If the sympathetic bladder-neck 'lock' fails, semen flows backward into the bladder - retrograde ejaculation ('dry orgasm').\",\n      \"safety_note\": \"Retrograde ejaculation is usually benign but affects fertility; document and discuss causes (TURP, alpha-blockers, diabetes).\"\n    }\n  ]\n}"
}
