{
  "schemaVersion": "2.0.0",
  "id": "topic:biochemistry:carbohydrates:polysaccharides",
  "slug": "polysaccharides",
  "title": "Polysaccharides and Their Functions",
  "subject": {
    "id": "subject:biochemistry",
    "slug": "biochemistry",
    "title": "Biochemistry"
  },
  "unit": {
    "id": "unit:biochemistry:carbohydrates",
    "slug": "carbohydrates",
    "title": "Carbohydrates",
    "order": 2
  },
  "order": 3,
  "status": "final",
  "sections": {
    "overview": "This section covers **polysaccharides** — large carbohydrates made of many sugar units — including the major examples (**starch, glycogen, cellulose, chitin**) and their roles in **energy storage** and **structure**.",
    "whyItMatters": "Polysaccharides are how organisms store energy (starch, glycogen) and build structures (cellulose, chitin). **Glycogen** is the body's glucose reserve, and **cellulose** is dietary fiber — both directly relevant to nutrition and metabolism.",
    "learningObjectives": "- Define **polysaccharide**.\n- Distinguish **storage** vs. **structural** polysaccharides.\n- Describe starch, glycogen, cellulose, and chitin.\n- Explain **glycogen's** role in the body.",
    "keyTerms": "",
    "collegeNotes": "**Polysaccharides.** A **polysaccharide** (\"many sugars\") is a large carbohydrate **polymer** made of **many monosaccharides** (often hundreds or thousands, usually glucose) linked by **glycosidic bonds**. Their structure — how the sugars are linked and branched — determines their function. Broadly, polysaccharides serve two roles: **energy storage** and **structure**.\n\n**Storage polysaccharides.**\n\n- **Starch** — the **energy-storage** polysaccharide of **plants** (made of glucose). It's a major dietary carbohydrate; humans digest it (by amylase and maltase) into glucose. Forms include amylose (unbranched) and amylopectin (branched).\n- **Glycogen** — the **energy-storage** polysaccharide of **animals (including humans)**, made of glucose and **highly branched**. It's stored mainly in the **liver and skeletal muscles**. When blood glucose is low, the liver breaks down glycogen to **release glucose** into the blood (glycogenolysis); muscle glycogen fuels muscle activity. Its heavy branching allows **rapid** glucose release.\n\n**Structural polysaccharides.**\n\n- **Cellulose** — the **structural** polysaccharide of **plant cell walls**, also made of glucose but with a different linkage that humans **cannot digest**. In the diet, cellulose is **fiber** — it isn't absorbed for energy but supports healthy digestion (bulk, bowel regularity).\n- **Chitin** — a **structural** polysaccharide (containing nitrogen) found in **fungal cell walls** and the **exoskeletons** of insects and crustaceans.\n\n**Same sugar, different jobs.** Notably, **starch, glycogen, and cellulose are all made of glucose**, yet behave completely differently because of **how the glucose units are linked and branched**. This is a powerful example of how **structure determines function**.",
    "howItWorks": "Polysaccharides:\n\n```\nPolysaccharide = many monosaccharides (usually glucose) + glycosidic bonds (polymer)\nStorage: STARCH (plants; digestible) | GLYCOGEN (animals; highly branched; liver + muscle → rapid glucose release)\nStructural: CELLULOSE (plant walls; human-indigestible = dietary FIBER) | CHITIN (fungi/exoskeletons; has nitrogen)\nKey insight: starch, glycogen, cellulose = all glucose, but LINKAGE/BRANCHING → different function\n```",
    "comparisons": "| Polysaccharide | Source | Role | Digestible by humans? |\n| --- | --- | --- | --- |\n| Starch | Plants | Energy storage | Yes |\n| Glycogen | Animals (liver/muscle) | Energy storage | Yes (own reserve) |\n| Cellulose | Plant cell walls | Structure (fiber) | No |\n| Chitin | Fungi, exoskeletons | Structure | No |",
    "highYield": "### High-Yield Pre-Nursing Connections\n\n**Glycogen** is the body's short-term **glucose reserve** — the liver releases glucose from glycogen to maintain blood sugar between meals (glucagon-stimulated), central to metabolism and diabetes care. **Cellulose = dietary fiber**, important for digestive health, bowel regularity, and satiety. **Starch** is a major dietary carbohydrate affecting blood glucose. Understanding **glycogenolysis** (glycogen → glucose) supports later metabolism and endocrine topics. \"Structure determines function\" is a recurring biochemistry theme.",
    "commonConfusions": "- **Starch (plant storage) vs. glycogen (animal storage) vs. cellulose (plant structure/fiber)** — all glucose, different linkage.\n- **Glycogen is highly branched** for rapid glucose release and stored in **liver and muscle**.\n- **Humans cannot digest cellulose** — it's fiber, not an energy source.\n- **Structure (linkage/branching) determines function** despite the same monomer.",
    "memoryAids": "- **\"Starch = plant storage; Glycogen = 'glyco-Gen' animal storage.\"**\n- **\"Glycogen is branchy for fast release.\"**\n- **\"Cellulose = fiber (humans can't digest it).\"**",
    "eli10": "### ELI-10 Explains\n\n### Simple idea\nLink *lots* of sugars together and you get a **polysaccharide** — a giant sugar chain. Some are for storing energy (**starch** in plants, **glycogen** in you), and some are for building structures (**cellulose** in plants, which we eat as **fiber**).\n\n### Analogy\nIf a single sugar is one LEGO brick, a **polysaccharide** is a **giant LEGO castle** made of hundreds or thousands of bricks. Plants store their energy as **starch** (a big glucose castle), and your body stores *its* energy backup as **glycogen** — a **super-branchy** glucose castle kept in your **liver and muscles**. The branches are like having many doors on the castle, so glucose can be released **fast** when you need energy (like between meals or during exercise). Now here's the cool twist: plants also build their sturdy walls out of glucose, called **cellulose** — but the bricks are connected in a way our bodies **can't take apart**. So when we eat plants, cellulose passes through as **fiber**, which keeps our digestion moving smoothly. Amazingly, **starch, glycogen, and cellulose are all built from the same glucose brick** — they just behave totally differently because of **how the bricks are connected**.\n\n### What is actually happening\nFor nursing, **glycogen** is the star. It's your body's quick-access glucose savings account: when your blood sugar dips between meals, your liver breaks down glycogen and releases glucose to keep you steady (a hormone called glucagon signals this). This matters a lot in understanding blood sugar, diabetes, and exercise. **Cellulose (fiber)** matters for healthy digestion and is part of good nutrition advice. And the big idea — that the **same building block** can make totally different molecules depending on **how it's assembled** — is one of the most important lessons in all of biochemistry.\n\n### Where the analogy stops\nA LEGO castle is rigid and permanent, but glycogen is constantly being built up and torn down all day as your body balances energy — it's a living, shifting reserve, not a finished monument.",
    "quickReview": "- **Polysaccharides** are large **polymers** of many monosaccharides (usually glucose) joined by **glycosidic bonds**.\n- **Starch** (plant) and **glycogen** (animal, highly branched, stored in **liver and muscle**) are **energy-storage**; glycogen enables **rapid glucose release**.\n- **Cellulose** (plant cell walls, **indigestible fiber**) and **chitin** (fungi/exoskeletons) are **structural**.\n- **Starch, glycogen, and cellulose are all glucose** — their different **linkage/branching** gives different functions (\"structure determines function\").",
    "workedExamples": "",
    "references": [
      {
        "text": "OpenStax, *Biology 2e*, Chapter 3: Biological Macromolecules (carbohydrates). https://openstax.org/details/books/biology-2e",
        "url": "https://openstax.org/details/books/biology-2e"
      },
      {
        "text": "OpenStax, *Anatomy and Physiology 2e*, Chapter 24: Metabolism and Nutrition (glycogen, carbohydrate metabolism). https://openstax.org/details/books/anatomy-and-physiology-2e",
        "url": "https://openstax.org/details/books/anatomy-and-physiology-2e"
      }
    ]
  },
  "availability": {
    "collegeNotes": true,
    "eli10": true,
    "highYield": true,
    "quickReview": true,
    "workedExamples": false,
    "references": true,
    "exactQuestions": 0
  },
  "aliases": [],
  "authority": {},
  "provenance": {
    "sourceCollection": "prenursing_notes",
    "sourceFile": "Education/pre-nursing-study-hub-content/content/05-biochemistry/02-carbohydrates/03-polysaccharides.md",
    "importedWithoutRewriting": true
  },
  "sourceSnapshotMarkdown": ""
}
