{
  "schemaVersion": "2.0.0",
  "id": "topic:anatomy-physiology-1:muscular-system:overview-and-types-of-muscle-tissue",
  "slug": "overview-and-types-of-muscle-tissue",
  "title": "Overview and Types of Muscle Tissue",
  "subject": {
    "id": "subject:anatomy-physiology-1",
    "slug": "anatomy-physiology-1",
    "title": "Anatomy & Physiology I"
  },
  "unit": {
    "id": "unit:anatomy-physiology-1:muscular-system",
    "slug": "muscular-system",
    "title": "Muscular System",
    "order": 7
  },
  "order": 1,
  "status": "final",
  "sections": {
    "overview": "This section opens the muscular system by reviewing the **three muscle types** (skeletal, cardiac, smooth), the **four functional properties** all muscle shares, and the major **functions** of muscle. It builds on the histology overview and sets up the detailed skeletal-muscle physiology that follows.",
    "whyItMatters": "Muscle produces every movement — from walking to heartbeat to digestion — and generates most of your body heat. Understanding the shared properties and the differences among muscle types frames everything about movement, circulation, and many clinical scenarios.",
    "learningObjectives": "- Name the **three muscle types** and their control.\n- List the **four functional properties** of muscle.\n- Describe the major **functions** of the muscular system.\n- Connect muscle properties to their roles.",
    "keyTerms": "- **Skeletal muscle** — voluntary, striated muscle attached to bones.\n- **Cardiac muscle** — involuntary, striated heart muscle.\n- **Smooth muscle** — involuntary, non-striated muscle in organ walls.\n- **Excitability (responsiveness)** — ability to receive and respond to a stimulus.\n- **Contractility** — ability to shorten forcibly.\n- **Extensibility** — ability to be stretched.\n- **Elasticity** — ability to recoil to resting length.",
    "collegeNotes": "**Three muscle types (a quick review).** Recall from histology that the body has three muscle tissues: **skeletal** (voluntary, striated, attached to bones, moves the body), **cardiac** (involuntary, striated, heart only, with intercalated discs and automatic rhythm), and **smooth** (involuntary, non-striated, in the walls of hollow organs and vessels). This unit focuses mainly on **skeletal muscle**, the type you consciously control, returning to cardiac and smooth muscle at the end.\n\n**Four functional properties.** All muscle tissue shares four abilities that make movement possible:\n\n- **Excitability (responsiveness):** muscle cells respond to stimulation — usually a chemical signal from a nerve — by generating an electrical change across their membrane.\n- **Contractility:** the defining property — muscle can **shorten forcefully** when stimulated, pulling on whatever it's attached to.\n- **Extensibility:** muscle can be **stretched** beyond its resting length (for example, as an opposing muscle contracts).\n- **Elasticity:** after stretching or contracting, muscle **recoils** to its resting length.\n\nTogether, these let muscle contract, relax, be stretched, and spring back — a cycle repeated constantly.\n\n**Functions of the muscular system.** Muscle does more than move the skeleton:\n\n- **Producing movement:** of the body (walking, gestures) and of substances within it (blood by the heart, food by the gut, urine by the bladder).\n- **Maintaining posture:** small, continuous contractions keep you upright and stable against gravity.\n- **Stabilizing joints:** muscle tension reinforces joints as bones move.\n- **Generating heat:** contracting muscle releases heat as a byproduct — the main source of body heat and the reason **shivering** warms you (a thermoregulation link to Unit 1).\n- **Storing and moving materials:** smooth-muscle sphincters guard openings; muscle also protects internal organs.",
    "howItWorks": "Linking properties to function:\n\n1. **Excitability** lets a nerve signal reach the muscle.\n2. **Contractility** produces the force.\n3. **Extensibility + elasticity** let the muscle stretch and return so movement can repeat.\n4. The byproduct **heat** helps maintain body temperature.",
    "comparisons": "| Type | Control | Striated? | Location/role |\n| --- | --- | --- | --- |\n| Skeletal | Voluntary | Yes | Bones; body movement, posture, heat |\n| Cardiac | Involuntary | Yes | Heart; pumps blood |\n| Smooth | Involuntary | No | Organ/vessel walls; moves contents |\n\n| Property | Meaning |\n| --- | --- |\n| Excitability | Responds to stimulus |\n| Contractility | Shortens forcefully |\n| Extensibility | Can be stretched |\n| Elasticity | Recoils to resting length |",
    "highYield": "### High-Yield Pre-Nursing Connections\n\nMuscle's heat production underlies **shivering** (to warm up) and explains why high fever or intense exertion generates heat that must be dissipated. Postural and joint-stabilizing roles connect to mobility, fall risk, and rehabilitation. Smooth muscle's role in moving contents links to blood pressure, GI motility, and airway function — all common medication targets. Loss of muscle mass (as in aging or immobility) affects strength, metabolism, and recovery.",
    "commonConfusions": "- **Three types, different control.** Only **skeletal** muscle is voluntary; cardiac and smooth are automatic.\n- **Contractility vs excitability.** Excitability is *responding* to a signal; contractility is *shortening*.\n- **Muscle can pull, not push.** Contraction only shortens; movement in the opposite direction requires a different muscle.\n- **Heat is a major function**, not just a side effect — it's central to thermoregulation.",
    "memoryAids": "- **Four properties: \"Every Cool Extended Exercise\"** → Excitability, Contractility, Extensibility, Elasticity.\n- **Functions: \"Move, Maintain, Stabilize, Heat.\"**\n- **Muscles pull, never push.**",
    "eli10": "### ELI-10 Explains\n\n### Simple idea\nMuscles are the body's motors. They can only do one basic thing — squeeze shorter — but that one trick powers all your movement, keeps you standing, and even keeps you warm.\n\n### Analogy\nThink of a muscle like a stretchy rubber band that can pull itself tight on command. It can be **stretched** longer and it **springs back** to its resting length, and when it gets the \"go\" signal it **pulls tight** (contracts). Because a rubber band can only *pull*, muscles work in teams — one pulls a bone one way, and a different one pulls it back. Every time these \"rubber bands\" work, they give off a little **heat**, which is why moving warms you up and why shivering (fast tiny muscle pulls) heats you when you're cold.\n\n### What is actually happening\nAll muscle shares four abilities: it **responds** to a signal (excitability), **shortens** with force (contractility), can be **stretched** (extensibility), and **bounces back** (elasticity). You control your **skeletal** muscles on purpose, but your **heart** muscle and the **smooth** muscle in your gut and blood vessels run automatically. Beyond movement, muscles hold your **posture**, steady your **joints**, and make most of your **body heat**.\n\n### Where the analogy stops\nA rubber band just snaps back passively, but a muscle actively burns energy (ATP) every time it contracts, and it's alive — it can grow stronger with use or shrink when unused, which a rubber band never does.",
    "quickReview": "- Three muscle types: **skeletal** (voluntary, striated), **cardiac** (involuntary, striated, heart), **smooth** (involuntary, non-striated); this unit focuses on skeletal.\n- All muscle shares four properties: **excitability, contractility, extensibility, elasticity**.\n- Muscle functions: **movement, posture, joint stabilization, heat generation**, and moving materials.\n- Muscle can only **pull (shorten)**, so muscles work in opposing teams; its heat output is central to thermoregulation.",
    "workedExamples": "",
    "references": [
      {
        "text": "OpenStax, *Anatomy and Physiology 2e*, Chapter 10.1–10.2: Overview of Muscle Tissue. https://openstax.org/details/books/anatomy-and-physiology-2e",
        "url": "https://openstax.org/details/books/anatomy-and-physiology-2e"
      },
      {
        "text": "U.S. National Library of Medicine, MedlinePlus — Muscle Disorders. https://medlineplus.gov/muscledisorders.html",
        "url": "https://medlineplus.gov/muscledisorders.html"
      }
    ]
  },
  "availability": {
    "collegeNotes": true,
    "eli10": true,
    "highYield": true,
    "quickReview": true,
    "workedExamples": false,
    "references": true,
    "exactQuestions": 42
  },
  "aliases": [],
  "authority": {},
  "provenance": {
    "sourceCollection": "prenursing_notes",
    "sourceFile": "Education/pre-nursing-study-hub-content/content/01-anatomy-physiology-i/07-muscular-system/01-overview-and-types-of-muscle-tissue.md",
    "importedWithoutRewriting": true
  },
  "sourceSnapshotMarkdown": ""
}
