{
  "schemaVersion": "2.0.0",
  "id": "topic:healthcare-communication:core-topics:handoffs-and-documentation-communication",
  "slug": "handoffs-and-documentation-communication",
  "title": "Handoffs and Documentation Communication",
  "subject": {
    "id": "subject:healthcare-communication",
    "slug": "healthcare-communication",
    "title": "Healthcare Communication"
  },
  "unit": {
    "id": "unit:healthcare-communication:core-topics",
    "slug": "core-topics",
    "title": "Core Topics",
    "order": 1
  },
  "order": 10,
  "status": "final",
  "sections": {
    "overview": "",
    "whyItMatters": "",
    "learningObjectives": "",
    "keyTerms": "",
    "collegeNotes": "",
    "howItWorks": "",
    "comparisons": "",
    "highYield": "",
    "commonConfusions": "",
    "memoryAids": "",
    "eli10": "### Question 1\n\nPicture a relay race. The handoff is the instant the baton actually changes hands, and from that instant the race belongs to the next runner. In healthcare the baton is two things at once: everything known about the patient, and the responsibility for what happens next. Charting is more like the scorekeeper's book - useful and permanent, but it never changes who is running. Delegation is handing a teammate your water bottle: you gave away a task, not the race.\n\n### Question 2\n\nThink of a long project handed between shifts of collaborators. If nobody writes down what was tried and what happened, the next person repeats the same work or unknowingly undoes it. The chart is that shared working log - what was found, when it was found, and what was done about it. Other departments do mine the log afterward for billing and quality reports, but that is downstream use. The log exists so the next clinician can pick up exactly where the last one left off.\n\n### Question 3\n\nTwo clinicians can swap information about a patient in a hallway, or they can do it in the room with the patient listening. Only the second version lets the person with the most direct knowledge - the patient - interrupt and say 'that dose was changed this morning' or 'the pain is on the other side.' That is bedside shift report: the same information, moved to where it can be fact-checked in real time by the one source that was never in the room before.\n\n### Question 4\n\nPacking with a checklist, you almost never forget the toothbrush. Packing from memory while someone talks at you, you forget something every time - and you do not notice until you need it. A handoff template is the checklist: it makes omissions visible instead of silent. Protecting report from interruptions is closing the door so you can get through the list without restarting your train of thought.\n\n### Question 5\n\nObjective is what a camera would capture: the number on the monitor, the size of the wound, the distance walked. Subjective is what a microphone would capture: 'my stomach feels like it is on fire.' Quoting the patient is the difference between playing the recording back and paraphrasing it from memory - the paraphrase quietly inserts your interpretation, and days later a reader has no way to tell which words were the patient's and which were yours.\n\n### Question 6\n\nRecording only a game's final score tells you who won but not when the game turned, and 'when' is exactly what explains the loss. A chart works the same way: the value is not just that the blood pressure was 88/50, it is that it was 88/50 at 1400 and 120/72 at 1000. Chart as you go and the sequence survives; chart at 1900 and all that is left is an averaged impression of the whole shift.\n\n### Question 7\n\nAir traffic control gives a pilot a runway number and the pilot reads it back. Not out of courtesy - because if the pilot heard 'one seven' when the controller said 'two seven,' the error surfaces in two seconds instead of two minutes. Handoff read-back does the identical job: speaking is evidence that a message was sent, and only the response is evidence that it arrived intact.\n\n### Question 8\n\n'He was being difficult' gives the next nurse nothing to act on and, if the chart is ever read aloud in a deposition, nothing to defend. 'He said it burns, he was breathing 24 times a minute, and he was gripping the rail' lets any reader see what you saw and reach the same conclusion. Charting is like writing directions for a stranger: 'turn left at the red barn' works for everyone, while 'go until it feels right' only works for someone who already knows the road.\n\n### Question 9\n\nIn any ledger that carries legal weight, a mistake is struck through, initialed, and corrected beside it - never erased, because the visible correction is what proves nothing was hidden. Electronic records enforce this automatically through an audit trail that retains every version along with who changed it and when. That is why trying to make an entry vanish is always worse than the entry itself: the system has already recorded the attempt.\n\n### Question 10\n\nImagine taking over a project mid-crisis and being told only 'yesterday was rough.' You still do not know what broke, what was already tried, or what is likely to break next - which is everything you actually need. A usable handoff answers three questions: what changed from baseline, what was done about it, and what should trigger concern in the next few hours. Without those, the report is a mood, not information.\n\n### Question 11\n\nThink of a group chat where someone forwards the same weather screenshot every morning: crisp, well formatted, and from last Tuesday. An auto-filled handoff tool can do the same thing - hand you yesterday's potassium under this morning's timestamp, in a layout that looks freshly verified. The formatting is the hazard, because information that looks reviewed tends not to get reviewed. Someone still has to open the window.\n\n### Question 12\n\nA verbal handoff is the halftime huddle: brief, prioritized, aimed entirely at the next period of play. The chart is the full game film: complete, timestamped, and reviewable by someone who was never in the building. You would not skip the film because the huddle went well, and you would not replace the huddle with three hours of tape. They answer different questions - 'what do I do now' and 'what exactly happened' - and each is useless in the other's role.",
    "quickReview": "",
    "workedExamples": "",
    "references": [
      {
        "text": "TeamSTEPPS (SBAR, team communication) — AHRQ",
        "url": "https://www.ahrq.gov/teamstepps/index.html"
      },
      {
        "text": "Health Literacy — CDC",
        "url": "https://www.cdc.gov/health-literacy/php/about/index.html"
      }
    ]
  },
  "availability": {
    "collegeNotes": false,
    "eli10": true,
    "highYield": false,
    "quickReview": false,
    "workedExamples": false,
    "references": true,
    "exactQuestions": 12
  },
  "aliases": [],
  "authority": {},
  "provenance": {
    "sourceCollection": "expansion-question-bank",
    "sourceFile": "Education/pre-nursing-expansion-question-bank/questions/16-healthcare-communication/331-handoffs-and-documentation-communication.json",
    "importedWithoutRewriting": true,
    "teachingNoteAvailable": false
  },
  "sourceSnapshotMarkdown": ""
}
